Услуга,Цена,Время,URL
Провести время с администратором на ресепшене,6 000 ₽,60 минут,https://garem54.ru/wp-content/uploads/2024/03/admin.jpg
Вызвать администратора который не в смене,20 000 ₽,60 минут,https://garem54.ru/wp-content/uploads/2024/03/admin-smena.jpg
Присутствие на программе администратора топлес,7 000 ₽,10 минут,https://garem54.ru/wp-content/uploads/2024/03/admin-toples.jpg
Закрыть салон на 24 часа,400 000 ₽,24 часа,https://garem54.ru/wp-content/uploads/2024/03/salon-close.jpg
Купить нижнее белье администратора,5 000 ₽,nan,https://garem54.ru/wp-content/uploads/2024/03/bilie.jpg
Третий не лишний,4 000 ₽,60 минут,https://garem54.ru/wp-content/uploads/2024/03/treriy.jpg
